{"$schema": "https://dbterd.datnguye.me/latest/schemas/erd/1.28.1.dev4+g07ebbcc.d20260620/erd.json", "nodes": [{"id": "model.jaffle_shop.customers", "name": "model.jaffle_shop.customers", "label": null, "description": "Customer overview data mart, offering key details for each unique customer. One row per customer.", "resource_type": "model", "schema_name": "public", "database": "demo", "columns": [{"name": "customer_id", "data_type": "text", "description": "The unique key of the orders mart.", "is_primary_key": false, "is_foreign_key": false}, {"name": "customer_name", "data_type": "text", "description": "Customers' full name.", "is_primary_key": false, "is_foreign_key": false}, {"name": "count_lifetime_orders", "data_type": "bigint", "description": "Total number of orders a customer has ever placed.", "is_primary_key": false, "is_foreign_key": false}, {"name": "first_ordered_at", "data_type": "timestamp without time zone", "description": "The timestamp when a customer placed their first order.", "is_primary_key": false, "is_foreign_key": false}, {"name": "last_ordered_at", "data_type": "timestamp without time zone", "description": "The timestamp of a customer's most recent order.", "is_primary_key": false, "is_foreign_key": false}, {"name": "lifetime_spend_pretax", "data_type": "numeric", "description": "The sum of all the pre-tax subtotals of every order a customer has placed.", "is_primary_key": false, "is_foreign_key": false}, {"name": "lifetime_tax_paid", "data_type": "numeric", "description": "The sum of all the tax portion of every order a customer has placed.", "is_primary_key": false, "is_foreign_key": false}, {"name": "lifetime_spend", "data_type": "numeric", "description": "The sum of all the order totals (including tax) that a customer has ever placed.", "is_primary_key": false, "is_foreign_key": false}, {"name": "customer_type", "data_type": "text", "description": "Options are 'new' or 'returning', indicating if a customer has ordered more than once or has only placed their first order to date.", "is_primary_key": false, "is_foreign_key": false}], "compiled_sql": "with\n\ncustomers as (\n\n    select * from \"demo\".\"public\".\"stg_customers\"\n\n),\n\norders as (\n\n    select * from \"demo\".\"public\".\"orders\"\n\n),\n\ncustomer_orders_summary as (\n\n    select\n        orders.customer_id,\n\n        count(distinct orders.order_id) as count_lifetime_orders,\n        count(distinct orders.order_id) > 1 as is_repeat_buyer,\n        min(orders.ordered_at) as first_ordered_at,\n        max(orders.ordered_at) as last_ordered_at,\n        sum(orders.subtotal) as lifetime_spend_pretax,\n        sum(orders.tax_paid) as lifetime_tax_paid,\n        sum(orders.order_total) as lifetime_spend\n\n    from orders\n\n    group by 1\n\n),\n\njoined as (\n\n    select\n        customers.*,\n\n        customer_orders_summary.count_lifetime_orders,\n        customer_orders_summary.first_ordered_at,\n        customer_orders_summary.last_ordered_at,\n        customer_orders_summary.lifetime_spend_pretax,\n        customer_orders_summary.lifetime_tax_paid,\n        customer_orders_summary.lifetime_spend,\n\n        case\n            when customer_orders_summary.is_repeat_buyer then 'returning'\n            else 'new'\n        end as customer_type\n\n    from customers\n\n    left join customer_orders_summary\n        on customers.customer_id = customer_orders_summary.customer_id\n\n)\n\nselect * from joined"}, {"id": "model.jaffle_shop.locations", "name": "model.jaffle_shop.locations", "label": null, "description": null, "resource_type": "model", "schema_name": "public", "database": "demo", "columns": [{"name": "location_id", "data_type": "text", "description": null, "is_primary_key": false, "is_foreign_key": false}, {"name": "location_name", "data_type": "text", "description": null, "is_primary_key": false, "is_foreign_key": false}, {"name": "tax_rate", "data_type": "double precision", "description": null, "is_primary_key": false, "is_foreign_key": false}, {"name": "opened_date", "data_type": "timestamp without time zone", "description": null, "is_primary_key": false, "is_foreign_key": false}], "compiled_sql": "with\n\nlocations as (\n\n    select * from \"demo\".\"public\".\"stg_locations\"\n\n)\n\nselect * from locations"}, {"id": "model.jaffle_shop.metricflow_time_spine", "name": "model.jaffle_shop.metricflow_time_spine", "label": null, "description": null, "resource_type": "model", "schema_name": "public", "database": "demo", "columns": [{"name": "date_day", "data_type": "date", "description": null, "is_primary_key": false, "is_foreign_key": false}], "compiled_sql": "-- metricflow_time_spine.sql\nwith\n\ndays as (\n\n    --for BQ adapters use \"DATE('01/01/2000','mm/dd/yyyy')\"\n    \n    with date_spine as\n(\n\n    \n\n\n\n\n\nwith rawdata as (\n\n    \n\n    \n\n    with p as (\n        select 0 as generated_number union all select 1\n    ), unioned as (\n\n    select\n\n    \n    p0.generated_number * power(2, 0)\n     + \n    \n    p1.generated_number * power(2, 1)\n     + \n    \n    p2.generated_number * power(2, 2)\n     + \n    \n    p3.generated_number * power(2, 3)\n     + \n    \n    p4.generated_number * power(2, 4)\n     + \n    \n    p5.generated_number * power(2, 5)\n     + \n    \n    p6.generated_number * power(2, 6)\n     + \n    \n    p7.generated_number * power(2, 7)\n     + \n    \n    p8.generated_number * power(2, 8)\n     + \n    \n    p9.generated_number * power(2, 9)\n     + \n    \n    p10.generated_number * power(2, 10)\n     + \n    \n    p11.generated_number * power(2, 11)\n    \n    \n    + 1\n    as generated_number\n\n    from\n\n    \n    p as p0\n     cross join \n    \n    p as p1\n     cross join \n    \n    p as p2\n     cross join \n    \n    p as p3\n     cross join \n    \n    p as p4\n     cross join \n    \n    p as p5\n     cross join \n    \n    p as p6\n     cross join \n    \n    p as p7\n     cross join \n    \n    p as p8\n     cross join \n    \n    p as p9\n     cross join \n    \n    p as p10\n     cross join \n    \n    p as p11\n    \n    \n\n    )\n\n    select *\n    from unioned\n    where generated_number <= 3651\n    order by generated_number\n\n\n\n),\n\nall_periods as (\n\n    select (\n        \n\n    \n\n    cast(cast(\n    cast(now() as timestamp)\n        at time zone 'UTC' at time zone 'America/Los_Angeles' as timestamp\n) as date) + ((interval '1 day') * (-3650))\n\n + ((interval '1 day') * ((row_number() over (order by 1) - 1)))\n\n\n    ) as date_day\n    from rawdata\n\n),\n\nfiltered as (\n\n    select *\n    from all_periods\n    where date_day <= cast(\n\n    cast(cast(\n    cast(now() as timestamp)\n        at time zone 'UTC' at time zone 'America/Los_Angeles' as timestamp\n) as date) + ((interval '1 day') * (1))\n\n as date)\n\n)\n\nselect * from filtered\n\n\n\n)\nselect\n    cast(d.date_day as timestamp) as date_day\nfrom\n    date_spine d\n\n\n\n),\n\ncast_to_date as (\n\n    select cast(date_day as date) as date_day\n\n    from days\n\n)\n\nselect * from cast_to_date"}, {"id": "model.jaffle_shop.order_items", "name": "model.jaffle_shop.order_items", "label": null, "description": null, "resource_type": "model", "schema_name": "public", "database": "demo", "columns": [{"name": "order_item_id", "data_type": "text", "description": null, "is_primary_key": false, "is_foreign_key": false}, {"name": "order_id", "data_type": "text", "description": null, "is_primary_key": false, "is_foreign_key": true}, {"name": "product_id", "data_type": "text", "description": null, "is_primary_key": false, "is_foreign_key": false}, {"name": "ordered_at", "data_type": "timestamp without time zone", "description": null, "is_primary_key": false, "is_foreign_key": false}, {"name": "product_name", "data_type": "text", "description": null, "is_primary_key": false, "is_foreign_key": false}, {"name": "product_price", "data_type": "numeric", "description": null, "is_primary_key": false, "is_foreign_key": false}, {"name": "is_food_item", "data_type": "boolean", "description": null, "is_primary_key": false, "is_foreign_key": false}, {"name": "is_drink_item", "data_type": "boolean", "description": null, "is_primary_key": false, "is_foreign_key": false}, {"name": "supply_cost", "data_type": "numeric", "description": null, "is_primary_key": false, "is_foreign_key": false}], "compiled_sql": "with\n\norder_items as (\n\n    select * from \"demo\".\"public\".\"stg_order_items\"\n\n),\n\n\norders as (\n\n    select * from \"demo\".\"public\".\"stg_orders\"\n\n),\n\nproducts as (\n\n    select * from \"demo\".\"public\".\"stg_products\"\n\n),\n\nsupplies as (\n\n    select * from \"demo\".\"public\".\"stg_supplies\"\n\n),\n\norder_supplies_summary as (\n\n    select\n        product_id,\n\n        sum(supply_cost) as supply_cost\n\n    from supplies\n\n    group by 1\n\n),\n\njoined as (\n\n    select\n        order_items.*,\n\n        orders.ordered_at,\n\n        products.product_name,\n        products.product_price,\n        products.is_food_item,\n        products.is_drink_item,\n\n        order_supplies_summary.supply_cost\n\n    from order_items\n\n    left join orders on order_items.order_id = orders.order_id\n\n    left join products on order_items.product_id = products.product_id\n\n    left join order_supplies_summary\n        on order_items.product_id = order_supplies_summary.product_id\n\n)\n\nselect * from joined"}, {"id": "model.jaffle_shop.orders", "name": "model.jaffle_shop.orders", "label": null, "description": "Order overview data mart, offering key details for each order inlcluding if it's a customer's first order and a food vs. drink item breakdown. One row per order.", "resource_type": "model", "schema_name": "public", "database": "demo", "columns": [{"name": "order_id", "data_type": "text", "description": "The unique key of the orders mart.", "is_primary_key": false, "is_foreign_key": false}, {"name": "location_id", "data_type": "text", "description